"espacio_cultural_id,provincia_id,localidad_id,observaciones,provincia,localidad,nombre,direccion,codigo_postal,codigo_indicativo_telefono,telefono,mail,web,latitud,longitud,fuente,juridisccion,anio_de_creacion,descripcion_de_patrimonio,anio_de_inauguracion,"
"300265,30,30008020,,Entre R’os,Col—n,Museo Provincial Molino Forclaz,Camino de Los Colonos S/N,3283,3447,472351,,,-32.225643,-58.141999,DNPyM,Provincial,,El museo lleva el nombre de la familia que en su origen creo el molino de viento cuyo propietario original era Juan Bautista Forclaz y fue protegido hasta nuestros dias por vecinos de la colonia. Conserva maquinas y muebles de la epoca.,2015,"
"300288,30,30015060,,Entre R’os,Concordia,Museo Regional Municipal Palacio Arruabarrena,Entre Rios 952,E3200ACF,345,4211883,museoregionalarrua@hotmail.com,,-31.3913,-58.0175,DNPyM,Municipal,1984,Historia ciencias naturales ciencia y tecnica arqueologia etnografia y folklore.,1984,"
"300287,30,30015060,,Entre R’os,Concordia,Museo De Antropologia Y Ciencias Naturales De Concordia,B. Rivadavia 456 Esq. Carriego,E3200BDF,345,4213149,,,-31.401296,-58.013225,DNPyM,Mixta,2000,Vestigios de culturas aborigenes que habitaron la region de Salto Grande minerales de todo el mundo restos fosiles animales y vegetales del Terciario y Cuaternario. Flora y fauna del Dep. Concordia. Artesanias actuales de aborigenes sudamericanos.,2001,"
"300588,30,30084150,,Entre R’os,Oro Verde,Museo Regional Conrado Hasenauer,Los Tordos (Detras del Complejo Municipal de Piletas),E3100XAD,,,,,-31.82817,-60.518265,DNPyM,Municipal,,Creado con el fin de rescatar la historia de Oro Verde el museo homenajea con su nombre al fundador de esta localidad del oeste entrerriano e invita a descubrir su pasado. Cuenta con exposiciones de objetos donados por los vecinos que permiten reconstru,,"
"300284,30,30015060,,Entre R’os,Concordia,Museo Judio De Entre Rios,Entre Rios 476,E3200ABH,345,4214088,,,-31.399776,-58.019447,DNPyM,Privada,,El museo recrea parte del pasado provincial a partir de la experiencia de los inmigrantes judios conocidos popularmente como los Gauchos Judios expresion acu–ada por el poeta A. Gerchunoff y asociada al originario trabajo rural de los mismos.,,"
"300282,30,30015060,,Entre R’os,Concordia,Museo De Salto Grande,Ruta 15 (Al Noreste de la Ciudad de Concordia),3200,345,4216612,,,-31.352101,-58.008647,DNPyM,,,Exhibe herramientas y materiales que forjaron la historia del proyecto y la construccion del Complejo Hidroelectrico Salto Grande desde hallazgos arqueologicos de las excavaciones equipos electromecanicos y parte de la documentacion propia de esta obra,,"
"300285,30,30015060,,Entre R’os,Concordia,Museo Del Recuerdo,Coronel Pedro Espino N_ 115,E3200DWC,345,4217347,,,-31.4016,-58.0173,DNPyM,Privada,,Es el primer museo particular con Honoplateca civil y militar y en el se representa la historia local desde 1834 hasta 1950 a traves de objetos cotidianos cargados de momentos e imaginarios colectivos.,,"
"300286,30,30015060,,Entre R’os,Concordia,Museo Municipal De Artes Visuales,Urquiza 638 Planta Alta,E3200AGJ,345,4228588,museoavcdia@yahoo.com,,-31.3971,-58.0178,DNPyM,Municipal,1948,El museo custodia un patrimonio de gran heterogeneidad constituido por una relevante coleccion de obras pictoricas grabados dibujos esculturas fotografias y piezas en ceramica pertenecientes a diferentes  artistas argentinos contemporaneos mayorita,1952,"
"300283,30,30015060,,Entre R’os,Concordia,Museo Historico Militar Coronel Leopoldo Ornstein,San Juan y Arruabarrena S/N,E3200BBJ,345,4251031,,,-31.370442,-58.007516,DNPyM,,,,,"
"300386,30,30088010,,Entre R’os,General Campos,Museo Regional Malva Emparanza,Herminio y Quiroz S/N,,345,490138,museoregionalgralcampos@yahoo.com.ar,,-31.53351,-58.40057,DNPyM,,,Este museo fue inaugurado el 18 de agosto de 1991 donado por la Sra. Malva Emparanza quien durante muchos a–os colecciono diferentes objetos y decidio legarlos al pueblo de General Campos.,,"
"300852,30,30088020,,Entre R’os,San Salvador,Museo Del Arroz,San Martin y Manuel Belgrano,3218,345,4910035,,,-31.623999,-58.507167,DNPyM,Municipal,2011,Difundir preservar y recuperar el patrimonio historico referente a la produccion arrocera que da identidad social a la comunidad San Salvadore–a valorizando y rescatando el patrimonio cultural tangible e intangible de la historia regional.,2008,"
"301035,30,30113080,,Entre R’os,Villaguay,Museo Historico Regional Municipal,Juan Hermelo 519,E3240DNK,3455,424222,,,-31.867872,-59.02908,DNPyM,Municipal,1975,Armas puntas de flecha y boleadoras indigenas medallas y monedas imprenta herramientas rurales aperos arte sacro pertenencias y documentacion del Caudillo Crispin Velazquez. Objetos que recuerdan a los inmigrantes Belgas sala de la mujer. El muse,1982,"
"300999,30,30113070,,Entre R’os,Villa Dom’nguez,Museo Y Archivo Historico Regional De Las Colonias Judias,San Martin 99,E3246BAA,3455,492191,museodelascolonias@infinet.com.ar,,-31.98512,-58.96297,DNPyM,Municipal,1985,El museo tiene como principal objetivo recrear la gesta inmigratoria judia a la provincia de Entre Rios a partir del a–o 1892. Su patrimonio esta constituido principalmente por un importante archivo documental y fotografico contando ademas con extensa b,1985,"
"300729,30,30091100,,Entre R’os,Rosario del Tala,Museo Municipal Rosario Del Tala,Urquiza 259,E3174BLE,,,,,-32.301486,-59.137896,DNPyM,Municipal,1965,Objetos historicos de los siglos XIX y XX pertenecientes a los antiguos pobladores de la zona: iconografia numismatica objetos religiosos armas folklore y arqueologia.,1965,"
"300110,30,30028010,,Entre R’os,Chajari,Museo Municipal Ivy Mara Ey - La Tierra Sin Mal,Urquiza y Sarmiento. Ex Estacion del Ferrocarril,E3228DHJ,3456,420730,,,-30.756532,-57.984198,DNPyM,Municipal,,A traves de preciosas piezas etnograficas de variadas culturas nativas se muestra didacticamente la historia del hombre de nuestro territorio desde su ingreso hace mas de 15 mil a–os hasta nuestros dias. Se puede apreciar las raices mas antiguas de nu,,"
"300851,30,30088020,,Entre R’os,San Salvador,Museo De La Estacion,Giacomelli S/N. Estacion de San Salvador,3218,,,,,-31.62796,-58.5041,DNPyM,,,El museo recoge el pasado de la actividad ferroviaria de la zona. Ubicado en el corazon del barrio mas antiguo de San Salvador la estacion es un importante punto de encuentro para las manifestaciones culturales.,,"
"300111,30,30028010,,Entre R’os,Chajari,Museo Regional Camila Quiroga,Adolfo Repetto 1870,E3228ALR,3456,424418,museocamilaquiroga@yahoo.com,,-30.746825,-57.9785,DNPyM,Municipal,1981,Piezas pertenecientes a los pueblos originarios que habitaron la region. Elementos de los primeros pobladores y de la Colonia Villa Libertad actual ciudad de Chajari: mobiliario pinturas vestimenta armas objetos de liturgia herramientas. Publicacio,1982,"
"300363,30,30028070,,Entre R’os,Federaci—n,Museo De La Imagen Eladio Fernandez Piaggio,Las Hortensias S/N,3206,3456,481035,,,-30.996593,-57.929615,DNPyM,,,Concebido desde la nostalgia del pueblo perdido este museo se emplaza en lo que queda de la Vieja Federacion o ex emplazamiento. Su valor radica en la reconstruccion de la ciudad que fue trasladada en el a–o 1979 como consecuencia de la formacion del em,,"
"300362,30,30028070,,Entre R’os,Federaci—n,Museo Del Termalismo,Av. San Martin y Las Hortensias,E3206APR,3456,481586,,,-30.990957,-57.917085,DNPyM,Privada,,Exhibe la historia del primer pozo termal de la mesopotamia argentina resumida en un recorrido fotografico.,,"
"300600,30,30084160,,Entre R’os,Paran‡,Museo Provincial De Bellas Arte Dr. Pedro E. Martinez,Buenos Aires 355,E3100BQG,43,311527,prensabellasartes@yahoo.com.ar,,-31.7276,-60.53,DNPyM,Provincial,1926,Coleccion de pinturas de diferentes epocas de Cesareo Bernaldo de Quiros colecciones de los artistas entrerrianos Juana Gitlin -grabados- Francisco Marini -esculturas y ceramicas- y Gloria Montoya. Tambien se exhiben obras de pintores nacionales y extr,1981,"
"301036,30,30113080,,Entre R’os,Villaguay,Museo De Antropologia Indigena Tierra De Minuanes,Caseros 426,E3240BTR,,,,,-31.869937,-59.027312,DNPyM,Municipal,,Su acervo es testimonio etno-historico de las antiguas culturas que se desarrollaron en el centro de la provincia a la llegada de los europeos en este caso Charrua Minuanes. Se han formado sobre la base de estudios y de recoleccion efectuada a orillas d,2008,"
"300372,34,34014020,,Formosa,Formosa,Museo De La Policia,Barrio 2 de Abril,3600,,,,,-26.175324,-58.197289,DNPyM,,,,,"
"300373,34,34014020,,Formosa,Formosa,Museo Del Suri,Calle O` Higgins - Barrio San Miguel,3600,,,,,-26.180813,-58.201477,DNPyM,,,,,"
"300374,34,34014020,,Formosa,Formosa,Museo Historico Y Regional Juan Pablo Duffard,Av. 25 de Mayo 58,P3600AXN,,,,,-26.181834,-58.165025,DNPyM,Provincial,1960,Resume preserva y valoriza la memoria colectiva del pueblo Formose–o a traves de colecciones cuya naturaleza remite a la epopeya fundacional familias fundadoras primitivos habitantes simbolos provinciales instituciones y elementos institucionales e,1963,"
"300375,34,34014020,,Formosa,Formosa,Museo Sacro Cultural Padre Carmelo Sciullo,Barrio Villa del Rosario,3600,,,,,-26.199295,-58.207721,DNPyM,Provincial,,A traves de diversas colecciones se sintetizan los rastros de la historia de cada una de las 23 comunidades religiosas pertenecientes a la Parroquia Maria Auxiliadora que convivieron en la provincia de Formosa. Las muestras remiten a la historia y vida,2008,"
"300488,34,34049020,,Formosa,Laguna Blanca,Museo Regional Del Noreste Formose–o,Ruta 86,3613,,,direccionde patrimonio@formosa.gov.ar,,-25.132826,-58.245879,DNPyM,Provincial,,Preserva la memoria colectiva del Pueblo de Laguna Blanca y de toda la region del noreste Formose–o a traves de colecciones vinculadas a la educacion religiosidad Pueblo Qom instituciones trabajos agricolas ganaderos y hogare–os costumbres tradici,,"
"300609,34,34056040,,Formosa,Piran_,Museo Del Pueblo,Centro Municipal de Cultura y Deportes Roque Saenz Pe–a y San Lorenzo,3606,3717,461007,,,-25.733203,-59.10754,DNPyM,Municipal,1987,Fotografias y objetos vinculados con el asentamiento de los primeros pobladores. Testimonios del desarrollo historico de las instituciones locales.,1987,"
"301003,34,34021060,,Formosa,Villa Escolar,Museo De Ciencias Naturales,,3525,,,,,-26.622292,-58.670418,DNPyM,,,,,"
"300411,38,38094040,Codigo en Maimara,Jujuy,Huichaira,Museo En Los Cerros,Quebrada de Huichaira S/N,Y4624XAH,11,59142134,,,-23.610592,-65.408916,DNPyM,,,,,"
"300844,38,38063180,,Jujuy,San Pedro,Casa Museo Fernando Garcia Curten,Mitre 1574,B2930ABP,3329,427352,,,-33.683421,-59.669756,DNPyM,Mixta,1992,Esculturas pinturas y grabados de Fernando Garcia Curten.,1993,"
"300842,38,38063180,,Jujuy,San Pedro,Museo Historico Regional Fray Jose Maria Bottaro,9 de Julio 134,B2930HZD,3329,427677,musehistoricosanpedro@yahoo.com.ar,,-33.675601,-59.6616,DNPyM,Privada,1982,Colecciones y documentos referidos a la historia del lugar.,1982,"
"300408,38,38094040,Codigo en Maimara,Jujuy,Hornillos,Complejo Cultural Posta De Hornillos,Ruta Nac. N¡ 9 Km. 73,Y4622XAK,,,,,-22.080915,-65.997005,DNPyM,Provincial,,El complejo esta divido en cinco secciones la primera seccion esta dedicada a la historia de la Posta de Hornillos la segunda relata la historia de las armas desde el periodo Paleolitico hasta el siglo XX en la tercera se encuentra la sala de elemento,1983,"
"300511,38,38035080,,Jujuy,Libertador General San Martin,Museo David Rhys,25 de Mayo 99,E3103XAF,343,4918000,geociencia@uapar.edu,,-32.075717,-60.463175,DNPyM,Privada,1909,Mineralogia -rocas y minerales de diversas regiones del pais- paleontologia -restos de animales y plantas fosiles de la zona y del extranjero- botanica -restos de plantas de la region- y zoologia -restos de aves anfibios reptiles y mamiferos de la re,1909,"
"300843,38,38063180,,Jujuy,San Pedro,Museo Cacique Bonifacio Maidana,Av. 25 de Mayo y San Martin,3352,3751,470222,,,-26.622337,-54.114682,DNPyM,Municipal,1987,Arqueologia: restos del Paleolitico y del Neolitico hallados en la zona. Artesania Guarani. Especimenes de ciencias naturales. Objetos personales de los fundadores armas etc. Documentacion desde 1880.,1987,"
"300017,38,38021060,Codigo en san Salvador de Jujuy,Jujuy,Alto La Vi–a,Centro Cultural Y Museo Jorge Pasquini Lopez,Victor Hugo 45,Y4600XAU,388,154047509,,,-24.1826,-65.273,DNPyM,Privada,1995,Ubicado en el principal mirador natural de la ciudad de San Salvador de Jujuy  desde donde se puede contemplar la mas extrema diversidad de ecosistemas. Se exponen piezas arqueologicas. correspondientes a un amplio espectro cultural -desde los primeros,2000,"
"300416,38,38028040,,Jujuy,Humahuaca,Museo Del Patrimonio Intangible,Buenos Aires 433,Y4630BCI,388,154173549,,,-23.206936,-65.348366,DNPyM,Privada,,Su objetivo es conservar y exponer un conjunto de elementos que abarcan las manifestaciones materiales de todas las ramas del Folklore. Pertenencias de los campesinos del lugar instrumentos musicales del noroeste materiales y elaboracion de comidas y b,,"
"300337,38,38014040,,Jujuy,El Carmen,Museo Del Automovil Antiguo,Moreno 52 Esq. Peron,Y4603CHB,388,154208838,,,-24.384874,-65.267697,DNPyM,,,,,"
"300922,38,38094050,,Jujuy,Tilcara,Museo Medardo Pantoja,Alberro 560,Y4624ADL,388,154783241,,,-23.580989,-65.397861,DNPyM,Privada,1977,Obra de Medardo Pantoja oriundo de Tilcara y uno de los artistas mas representativas de la pintura Latinoamericana. Sus obras reflejan el paisaje la gente y las costumbres del Norte Argentino.,1977,"
"300919,38,38094050,,Jujuy,Tilcara,Museo Ojito De Agua,Jujuy 558,Y4624APL,388,155812490,,,-23.577896,-65.394028,DNPyM,,,,,"
"300854,38,38021060,,Jujuy,San Salvador de Jujuy,Museo De Bellas Artes Jorge Mendoza,Av. Urquiza 410,Y4600AQD,388,4220149,,,-24.183245,-65.298692,DNPyM,Municipal,,,,"
"300861,38,38021060,,Jujuy,San Salvador de Jujuy,Museo Historico Provincial,Lavalle 256,Y4600EAF,388,4221355,,,-24.1859,-65.3028,DNPyM,Provincial,1943,En sus salas se presentan distintos aspectos de la historia Argentina. En la sala Exodo e independencia se guardan trofeos de la Batalla de Suipacha cartas del Gral. Belgrano y cuadros de la epoca. Sala dedicada a Sara Blas de Zenarruza -quien heredo la,1943,"
"300863,38,38021060,,Jujuy,San Salvador de Jujuy,Museo De Geologia Mineralogia Y Paleontologia,Av. Bolivia 1661,Y4600GNE,388,4221593,,,-24.179,-65.3431,DNPyM,Nacional,1946,Colecciones de minerales rocas y fosiles de la provincia de Jujuy y del mundo -Egipto EE.UU Espa–a Gran Breta–a Mexico. Paneles didacticos explicativos de los diferentes procesos geologicos.,2000,"
"300857,38,38021060,,Jujuy,San Salvador de Jujuy,Museo Catedral,Sarmiento Esq. Belgrano,Y4600DYF,388,4226569,,,-24.185225,-65.300154,DNPyM,Privada,,,,"
"300415,38,38028040,,Jujuy,Humahuaca,Museo Arqueologico Dr. Justiniano Torres Aparicio,Cordoba 115,Y4630BNC,388,4228993,,,-23.204655,-65.349799,DNPyM,Privada,,Coleccion de piezas de la zona de Inca Cueva madera tejidos cesteria cuero material litico y momias.,,"
"300957,38,38028060,,Jujuy,Uquia,Museo Takashi Takahashi,Catulo Aparicio S/N,Y4626XAD,388,4230901,,,-23.31883,-65.348666,DNPyM,,,El museo fue organizado en torno a la antigua casa en donde el artista japones estuvo radicado en Uquia. Exhibe obras de su autoria y la historia de quien fuera el fundador de la Escuela de los ni–os pintores de Chucalezna.,,"
"300860,38,38021060,,Jujuy,San Salvador de Jujuy,Museo De Arte Sacro San Francisco,Belgrano 677,Y4600ABK,388,4233434,,,-24.185158,-65.302111,DNPyM,Privada,,Elementos artisticos de fondos propios de la Orden Franciscana. Pintura e imagineria Cuzque–a mobiliario sacro de los siglos XVII y XVIII objetos liturgicos Coloniales y ornamentos Europeos.,2000,"
"300856,38,38021060,,Jujuy,San Salvador de Jujuy,Museo De Ciencias Naturales Carlos Darwin - Colegio Nacional N_1 Teodoro Sanchez De Bustamante,Gorriti 353,Y4600DXG,388,4233599,,,-24.184473,-65.298938,DNPyM,Provincial,,Alrededor de trece mil piezas dispuestas en tres salas. Su patrimonio esta integrado por material arqueologico antropologico y piezas de mineralogia y biologia. Tambien cuenta con una biblioteca especializada y sala de estudio taller y laboratorio.,,"
"300478,38,38112050,,Jujuy,La Quiaca,Museo Arqueologico Y Etnografico Musoj „an,Sarmiento 60,Y4650CYN,388,423423,,,-22.108933,-65.595921,DNPyM,Privada,,Piezas arqueologicas de epocas tempranas y tardias de la Cultura Yavi/Chicha. Piezas paleontologicas.,,"
"300920,38,38094050,,Jujuy,Tilcara,Museo De Ermitas Tilcare–as,Rivadavia S/N,Y4624AYL,388,4234386,,,-23.580989,-65.397861,DNPyM,,,,,"
"300855,38,38021060,,Jujuy,San Salvador de Jujuy,Museo En Maquetas Tupac Amaru,Alvear 1152,Y4600AJP,,,,,-24.184413,-65.309044,DNPyM,,,,,"
"300859,38,38021060,,Jujuy,San Salvador de Jujuy,Museo Historico Policial,Belgrano 493,Y4600ABG,388,4237764,,,-24.1852,-65.3001,DNPyM,Provincial,1994,El museo esta ubicado en las dependencias del antiguo edificio del Cabildo Juje–o -Monumento Historico Nacional. Cuenta con cuatro salas donde se exhiben uniformes antiguos armas de alto calibre armas blancas explosivos y documentos sobre delincuencia,1994,"
"300858,38,38021060,,Jujuy,San Salvador de Jujuy,Museo Y Centro Cultural Culturarte,San Martin Esq. Sarmiento,Y4600ADJ,388,4249539,,,-24.186419,-65.300074,DNPyM,,,,,"
"300853,38,38021060,,Jujuy,San Salvador de Jujuy,Museo Y Centro Cultural Casa Macedonio Graz,Lamadrid Esq. GŸemes,Y4600EDA,388,4310405,,,-24.183101,-65.307042,DNPyM,,,,,"
"300862,38,38021060,,Jujuy,San Salvador de Jujuy,Museo Arqueologico Provincial,Lavalle 434,Y4600EAJ,388,4310693,,,-24.1837,-65.303,DNPyM,Provincial,1994,Piezas pertenecientes a las Culturas Omaguaca San Francisco Yavi e Incaica. Ceramicas que datan de mas de 2.600 a–os colecciones liticas de puntas de flecha vasijas decoradas. Alberga tambien la Coleccion Massing conformada por objetos del periodo i,1994,"
"300924,38,38094050,,Jujuy,Tilcara,Museo Regional De Pintura Jose Antonio Terry,Rivadavia 352,Y4624AYH,388,4955005,museoterry@cootepal.com.ar,,-23.576974,-65.393049,DNPyM,Nacional,1958,Pinturas de Jose Antonio Terry y de otros artistas argentinos entre ellos Medardo Pantoja Eolo Pons Juan Carlos Entrocassi Maria Escudero Yolanda Albornoz Luisa Soto Luis Ramoneda Antonio Rodolfo Alvarado. Las obras estan vinculadas con las costu,1966,"
"300921,38,38094050,,Jujuy,Tilcara,Pucara,Pucara S/N (A 1 Km de Tilcara en la Margen Izquierda del Rio Grande),Y4624BIA,388,4955006,,,-23.580989,-65.397861,DNPyM,Nacional,,Este sitio arqueologico es testimonio de una prolongada ocupacion prehispanica en el area -siglo IX al XVI D. C.- que se ve interrumpida por la conquista Europea. Su superficie es de aproximadamente ocho hectareas y a lo largo del recorrido se puede acce,,"
"300925,38,38094050,,Jujuy,Tilcara,Museo Arqueologico Dr. Eduardo Casanova,Belgrano 445,Y4624AFI,388,4955006,,,-23.576811,-65.395368,DNPyM,Nacional,,Objetos arqueologicos de distintas areas del mundo nndino abarcando un amplio panorama de las culturas prehispanicas mas representativas de los actuales Peru Chile Bolivia y el Noroeste Argentino. Asimismo con el objetivo de vincular el pasado con el,1968,"
"300923,38,38094050,,Jujuy,Tilcara,Museo De Bellas Artesfundacion Hugo Irureta,Belgrano y Bolivar,Y4624AFH,388,4955124,,,-23.576956,-65.394673,DNPyM,Privada,1991,Pinturas dibujos grabados y esculturas de artistas argentinos y extranjeros. Las obras argentinas estan comprendidas entre los a–os 1920 y nuestros dias.,,"
"300409,38,38094020,,Jujuy,Huacalera,Museo Arqueologico E Historico De Huacalera,Calle Lavalle Esq. Av. 20 de Junio,Y4626XAI,388,4955204,,,-23.433613,-65.353734,DNPyM,Municipal,2004,Coleccion perteneciente al sitio arqueologico La Huerta declarado Monumento Historico Nacional en el a–o 2000. Vasijas huesos y material litico producto de las investigaciones realizadas por el Dr. Jorge Palma.,,"
"300926,38,38094050,,Jujuy,Tilcara,Museo De Escultura Ernesto Soto Avenda–o,Belgrano 577,Y4624AFK,388,4955354,,,-23.577215,-65.393509,DNPyM,Provincial,1967,""El museo esta ubicado en la casa donde vivio el Coronel Manuel Alvarez Prado. Se exhiben esculturas en yeso del artista Ernesto Soto Avenda–o entre las que se destacan """"Cansancio"""" """"La pena"""" """"Trabajo"""" y una maqueta que reproduce en un decimo de su tam"",1974,,,,,,,,,,,,,,,,,,,,"
"300951,38,38098040,,Jujuy,Tumbaya,Museo Cecilio Bustamante,Coronel Quintana Esq. Buenos Aires S/N,4618,388,4996015,,,-23.864688,-65.472178,DNPyM,Privada,2005,Piezas de culturas precolombinas objetos de la vida cotidiana de fines del siglo XIX y principios del XX libros antiguos fotografias conmemorativas pinturas coleccion de monedas pinturas de calles de Tumbaya realizadas por Alfonso Maidana.,2005,"
"300477,38,38112050,,Jujuy,La Quiaca,Museo Comunitario Puna,Arabe Siria y 25 de Mayo,Y4650CMB,3885,423039,,,-22.103537,-65.597741,DNPyM,Municipal,,Piezas arqueologicos de la Cultura Yavi/Chicha Arcaico e Inka.,,"
"300512,38,38035080,,Jujuy,Libertador Gral. San Mart’n,Centro De Visitantes Ledesma,Reconquista 442 Barrio Ledesma,Y4512GCB,3886,429439,,,-23.831745,-64.789536,DNPyM,Privada,,Sitio interactivo en donde el visitantes puede responder a sus interrogantes sobre la produccion en la empresa o participar de procesos industriales esquematicos. En el patio de exposiciones se presentan maquinas de agro y piezas de maquinaria fabril pa,2008,"
"300076,38,38035040,,Jujuy,Calilegua,Museo Regional De Artes Plasticas Casique Calilegua,Av. Sarmiento Esq. San Martin,Y4514BOR,3886,430913,,,-23.774477,-64.76545,DNPyM,Municipal,,Su patrimonio artistico cuenta con 450 obras de arte entre pinturas esculturas dibujos y grabados de las cuales 150 se exponen en forma permanente. El museo funciona en una antigua construccion Neo-Colonial Inglesa y alberga obras artisticas de la re,2007,"
"300418,38,38028040,,Jujuy,Humahuaca,Museo Francisco Ramoneda,Salta 214,Y4630DNF,3887,421066,,,-23.202589,-65.346917,DNPyM,Privada,,Dibujos y pinturas del artista Francisco Ramoneda (1905-1977) de su primera etapa desarrollada en Buenos Aires y de la etapa posterior inspirada en los paisajes la gente y las costumbres festivas y religiosas de la Quebrada de Humahuaca y de todo el,1940,"
"300417,38,38028040,,Jujuy,Humahuaca,Museo Arqueologico Municipal,Santa Fe S/N Barrio Centro,Y4630BCP,3887,421375,,,-23.205505,-65.352316,DNPyM,Municipal,,Colecciones provenientes de yacimientos arqueologicos prehistoricos cultura Anaguaco.,,"
"300419,38,38028040,,Jujuy,Humahuaca,Museo  De Esculturas Nicasio Fernandez Mar,Buenos Aires S/N,Y4630BCP,3887,421375,,,-23.864688,-65.472178,DNPyM,Municipal,1988,Esculturas y bocetos del artista Nicasio Fernandez Mar. Fotografias anotaciones proyectos.,1988,"
"300956,38,38028060,,Jujuy,Uquia,Museo Familiar Dora Arancibia,Mariano Arancibia S/N,Y4626XAD,,,,,-23.31883,-65.348666,DNPyM,,,La casa de Dora Arancibia hoy convertida en museo da a conocer la historia de esta magnifica mujer recibida de maestra en 1930 que dedico su vida a ense–ar en los lugares mas inhospitos de la Quebrada de Humahuaca y a trabajar para la comunidad de su,,"
"301043,38,38112080,,Jujuy,Yavi,Casa Hacienda Del Marquesado De Tojo,Av. Marques Campero S/N,4651,3887,491138,,,-22.136021,-65.465489,DNPyM,Municipal,,La casa fue una de las principales posesiones del Marquesado de Tojo el cual perduro hasta 1813 cuando se abolieron los titulos nobiliarios. Destruida y saqueada en sucesivas oportunidades durante las Guerras de la Independencia y civiles es Patrimoni,,"
"300841,38,38063180,,Jujuy,San Pedro,Museo Historico Arqueologico Y De Arte Pablo Baldwin,Miguel F. Araoz Esq. 9 de Julio,Y4500EZJ,3888,15446466,,,-24.235257,-64.865667,DNPyM,,,Museo unico en la region que alberga la historia del Pueblo de San Pedro.,,"
"301044,38,38112090,,Jujuy,Yavi Chico,Museo Mama Antonia - Tata Portal,Comunidad Aborigen Yavi Chico,Y4651XAG,,,,,-22.095868,-65.467108,DNPyM,,1998,Coleccion arqueologica rescatada del sitio arqueologico de Yavi Chico conformada por vasijas piedras de moler puntas de flecha y elementos de la vida cotidiana recuperadas del Antigal que se encuentra a veinte minutos de Yavi Chico.,2008,"
"300388,42,42105030,,La Pampa,General Pico,Museo Regional Maraco,Calle 17 N¡ 560,L6360BAL,2302,421043,,,-35.663726,-63.756706,DNPyM,Municipal,1966,Las colecciones hacen referencia a la fundacion de la ciudad de Gral. Pico sus primeras instituciones la llegada del ferrocarril y la vida municipal. Fotografias mobiliario herramientas vajilla vestimenta instrumentos musicales y utensilios de div,1971,"
"300332,42,42105020,,La Pampa,Dorila,Museo Historico Dorila,Calle 10 esquina 3,L6365XAJ,2302,480101,,,-35.778659,-63.716875,DNPyM,Mixta,2011,Museo con historia de familias locales o que han pertenecido a esta localidad. Con variedad de elementos: utensilios de cocina y muebles de cocina fotografias ropa y moblaje de habitacion dormitorio revistas y libros radiosetc. Edificacion del muse,2011,"
"300016,42,42133020,,La Pampa,Alta Italia,Museo Historico Municipal,Aristobulo del Valle 351,L6207AEG,2302,491168,,,-35.333615,-64.119272,DNPyM,Municipal,2003,Objetos vinculados a la historia de la localidad de Alta Italia. Las colecciones proceden predominantemente de donaciones de los pobladores locales o de compras realizadas por el municipio.,2005,"
"300971,42,42056060,,La Pampa,Vertiz,Museo Municipal Del Centenario,Malvinas Argentinas 418 2 _,6365,2302,493039,,,-35.428586,-63.906396,DNPyM,Municipal,2007,Inaugurado el 20 de septiembre de 2007 fecha del centenario de la localidad exhibe objetos de pobladores e instituciones de Vertiz con el objeto de reconstruir la historia del pueblo. Posee una importante coleccion fotografica donde se reflejan las cos,2007,"
